PATIENT_ID,AGE,GENDER,RACE,ETHNICITY,INCOME,HEALTHCARE_EXPENSES,CONDITIONS,0.25 ML Leuprolide Acetate 30 MG/ML Prefilled Syringe,1 ML DOCEtaxel 20 MG/ML Injection,1 ML Epoetin Alfa 4000 UNT/ML Injection [Epogen],1 ML heparin sodium  porcine 5000 UNT/ML Injection,1 ML medroxyPROGESTERone acetate 150 MG/ML Injection,1 ML medroxyprogesterone acetate 150 MG/ML Injection,1 ML tacrolimus 5 MG/ML Injection [Prograf],10 ML Alfentanil 0.5 MG/ML Injection,10 ML Fentanyl 0.05 MG/ML Injection,10 ML Furosemide 10 MG/ML Injection,10 ML oxaliplatin 5 MG/ML Injection,100 ML Propofol 10 MG/ML Injection,12 HR Hydrocodone Bitartrate 10 MG Extended Release Oral Capsule,120 ACTUAT fluticasone propionate 0.044 MG/ACTUAT Metered Dose Inhaler [Flovent],150 ML vancomycin 5 MG/ML Injection,168 HR Ethinyl Estradiol 0.00146 MG/HR / norelgestromin 0.00625 MG/HR Transdermal System,2 ML Ondansetron 2 MG/ML Injection,2 ML morphine sulfate 1 MG/ML Injection,21 DAY ethinyl estradiol 0.000625 MG/HR / etonogestrel 0.005 MG/HR Vaginal System [NuvaRing],24 HR Donepezil hydrochloride 10 MG / Memantine hydrochloride 28 MG Extended Release Oral Capsule,24 HR Metformin hydrochloride 500 MG Extended Release Oral Tablet,24 HR metoprolol succinate 100 MG Extended Release Oral Tablet,24 HR metoprolol succinate 200 MG Extended Release Oral Tablet,24 HR metoprolol succinate 50 MG Extended Release Oral Tablet,24 HR tacrolimus 1 MG Extended Release Oral Tablet [Envarsus],25 ML protamine sulfate (USP) 10 MG/ML Injection,4 ML norepinephrine 1 MG/ML Injection,5 ML SUFentanil 0.05 MG/ML Injection,60 ACTUAT Fluticasone propionate 0.25 MG/ACTUAT / salmeterol 0.05 MG/ACTUAT Dry Powder Inhaler,72 HR Fentanyl 0.025 MG/HR Transdermal System,Abuse-Deterrent 12 HR Oxycodone Hydrochloride 10 MG Extended Release Oral Tablet [Oxycontin],Abuse-Deterrent 12 HR Oxycodone Hydrochloride 15 MG Extended Release Oral Tablet,Acetaminophen 160 MG Chewable Tablet,Acetaminophen 21.7 MG/ML / Dextromethorphan Hydrobromide 1 MG/ML / doxylamine succinate 0.417 MG/ML Oral Solution,Acetaminophen 300 MG / Codeine Phosphate 15 MG Oral Tablet,Acetaminophen 300 MG / HYDROcodone Bitartrate 5 MG Oral Tablet,Acetaminophen 300 MG / Hydrocodone Bitartrate 5 MG Oral Tablet,Acetaminophen 325 MG / HYDROcodone Bitartrate 7.5 MG Oral Tablet,Acetaminophen 325 MG / Oxycodone Hydrochloride 10 MG Oral Tablet [Percocet],Acetaminophen 325 MG / Oxycodone Hydrochloride 5 MG Oral Tablet,Acetaminophen 325 MG / oxyCODONE Hydrochloride 5 MG Oral Tablet,Acetaminophen 325 MG Oral Tablet,Acetaminophen 325 MG Oral Tablet [Tylenol],Alendronic acid 10 MG Oral Tablet,Allopurinol 100 MG Oral Tablet,Amoxicillin 250 MG / Clavulanate 125 MG Oral Tablet,Amoxicillin 250 MG Oral Capsule,Amoxicillin 500 MG Oral Tablet,Breath-Actuated 120 ACTUAT beclomethasone dipropionate 0.04 MG/ACTUAT Metered Dose Inhaler [Qvar],Cefuroxime 250 MG Oral Tablet,Chlorpheniramine Maleate 2 MG/ML Oral Solution,Cisplatin 50 MG Injection,Clopidogrel 75 MG Oral Tablet,Etonogestrel 68 MG Drug Implant,FLUoxetine 20 MG Oral Capsule,Fexofenadine hydrochloride 30 MG Oral Tablet,Fexofenadine hydrochloride 60 MG Oral Tablet,Furosemide 40 MG Oral Tablet,Galantamine 4 MG Oral Tablet,Hydrochlorothiazide 25 MG Oral Tablet,Hydrocortisone 10 MG/ML Topical Cream,Ibuprofen 100 MG Oral Tablet,Ibuprofen 200 MG Oral Tablet,Ibuprofen 400 MG Oral Tablet [Ibu],Leucovorin 100 MG Injection,Loratadine 5 MG Chewable Tablet,Meperidine Hydrochloride 50 MG Oral Tablet,Midazolam 1 MG/ML Injectable Solution,NDA020800 0.3 ML Epinephrine 1 MG/ML Auto-Injector,NDA020983 200 ACTUAT albuterol 0.09 MG/ACTUAT Metered Dose Inhaler [Ventolin],Naproxen 500 MG Oral Tablet,Naproxen sodium 220 MG Oral Tablet,Nitroglycerin 0.4 MG/ACTUAT Mucosal Spray,PACLitaxel 100 MG Injection,Penicillin V Potassium 250 MG Oral Tablet,Penicillin V Potassium 500 MG Oral Tablet,Rocuronium bromide 10 MG/ML Injectable Solution,Simvastatin 10 MG Oral Tablet,Simvastatin 20 MG Oral Tablet,Tamoxifen 10 MG Oral Tablet,Vitamin B12 5 MG/ML Injectable Solution,albuterol 0.83 MG/ML Inhalation Solution,albuterol 5 MG/ML Inhalation Solution,amLODIPine 2.5 MG Oral Tablet,amoxicillin 875 MG / clavulanate 125 MG Oral Tablet,aspirin 325 MG Oral Tablet,aspirin 81 MG Oral Tablet,atorvastatin 40 MG Oral Tablet,carvedilol 25 MG Oral Tablet,cefazolin 2000 MG Injection,cefpodoxime 200 MG Oral Tablet,cephalexin 500 MG Oral Tablet,cetirizine hydrochloride 5 MG Oral Tablet,ciprofloxacin 500 MG Oral Tablet,clopidogrel 300 MG Oral Tablet,diphenhydrAMINE Hydrochloride 25 MG Oral Tablet,doxycycline hyclate 100 MG,ferrous sulfate 325 MG Oral Tablet,heparin sodium  porcine 100 UNT/ML Injectable Solution,insulin  regular  human 100 UNT/ML Injectable Solution,insulin isophane  human 70 UNT/ML / insulin  regular  human 30 UNT/ML Injectable Suspension [Humulin],irbesartan 150 MG Oral Tablet,isoflurane 999 MG/ML Inhalation Solution,levonorgestrel 0.000729 MG/HR Intrauterine System [Kyleena],levonorgestrel 0.000813 MG/HR Intrauterine System [Liletta],levonorgestrel 0.000833 MG/HR Intrauterine System [Mirena],lisinopril 10 MG Oral Tablet,lisinopril 20 MG Oral Tablet,lisinopril 5 MG Oral Tablet,losartan potassium 25 MG Oral Tablet,losartan potassium 50 MG Oral Tablet,metoprolol tartrate 25 MG Oral Tablet,nitrofurantoin  macrocrystals 25 MG / nitrofurantoin  monohydrate 75 MG Oral Capsule,nitroglycerin 0.4 MG Sublingual Tablet,piperacillin 2000 MG / tazobactam 250 MG Injection,prasugrel 10 MG Oral Tablet,pravastatin sodium 40 MG Oral Tablet,predniSONE 5 MG Oral Tablet,proparacaine hydrochloride 5 MG/ML Ophthalmic Solution,remifentanil 2 MG Injection,simvastatin 20 MG Oral Tablet,sodium fluoride 0.0272 MG/MG Oral Gel,sulfamethoxazole 800 MG / trimethoprim 160 MG Oral Tablet,ticagrelor 90 MG Oral Tablet,tramadol hydrochloride 50 MG Oral Tablet,tropicamide 5 MG/ML Ophthalmic Solution,valsartan 320 MG Oral Tablet,{21 (ethinyl estradiol 0.03 MG / levonorgestrel 0.15 MG Oral Tablet) / 7 (inert ingredients 1 MG Oral Tablet) } Pack [Levora 0.15/30 28 Day],{24 (drospirenone 3 MG / ethinyl estradiol 0.02 MG Oral Tablet) / 4 (inert ingredients 1 MG Oral Tablet) } Pack [Yaz 28 Day],{28 (norethindrone 0.35 MG Oral Tablet) } Pack [Camila 28 Day],{28 (norethindrone 0.35 MG Oral Tablet) } Pack [Errin 28 Day],{28 (norethindrone 0.35 MG Oral Tablet) } Pack [Jolivette 28 Day],{5 (dienogest 2 MG / estradiol valerate 2 MG Oral Tablet) / 17 (dienogest 3 MG / estradiol valerate 2 MG Oral Tablet) / 2 (estradiol valerate 1 MG Oral Tablet) / 2 (estradiol valerate 3 MG Oral Tablet) / 2 (inert ingredients 1 MG Oral Tablet) } Pack [Natazia 28 Day],{5 (ethinyl estradiol 0.02 MG / norethindrone acetate 1 MG Oral Tablet) / 7 (ethinyl estradiol 0.03 MG / norethindrone acetate 1 MG Oral Tablet) / 9 (ethinyl estradiol 0.035 MG / norethindrone acetate 1 MG Oral Tablet) / 7 (ferrous fumarate 75 MG Oral Tablet) } Pack [Estrostep Fe 28 Day],{7 (ethinyl estradiol 0.01 MG Oral Tablet) / 84 (ethinyl estradiol 0.03 MG / levonorgestrel 0.15 MG Oral Tablet) } Pack [Seasonique],{7 (ethinyl estradiol 0.035 MG / norgestimate 0.18 MG Oral Tablet) / 7 (ethinyl estradiol 0.035 MG / norgestimate 0.215 MG Oral Tablet) / 7 (ethinyl estradiol 0.035 MG / norgestimate 0.25 MG Oral Tablet) / 7 (inert ingredients 1 MG Oral Tablet) } Pack [Trinessa 28 Day],index,Acute bacterial sinusitis (disorder),Acute bronchitis (disorder),Acute infective cystitis (disorder),Acute viral pharyngitis (disorder),Alzheimer's disease (disorder),Anemia (disorder),Awaiting transplantation of bone marrow (situation),Awaiting transplantation of kidney (situation),Childhood asthma (disorder),Chronic congestive heart failure (disorder),Chronic obstructive bronchitis (disorder),Contact dermatitis (disorder),Diabetes mellitus type 2 (disorder),Essential hypertension (disorder),Gingivitis (disorder),Gout,History of renal transplant (situation),Hyperlipidemia (disorder),Localized  primary osteoarthritis of the hand (disorder),Major depression  single episode (disorder),Malignant neoplasm of breast (disorder),Neoplasm of prostate (disorder),Non-small cell carcinoma of lung  TNM stage 1 (disorder),Osteoarthritis of hip (disorder),Osteoarthritis of knee (disorder),Osteoporosis (disorder),Overlapping malignant neoplasm of colon (disorder),Patient referral for dental care (procedure),Prediabetes (finding),Pyelonephritis (disorder),Sepsis (disorder),Septic shock (disorder),Sinusitis (disorder),Streptococcal sore throat (disorder),Viral sinusitis (disorder)
69af9fdb-6026-cf15-8110-60645be1a286,75,F,white,nonhispanic,53813,781858.42,Received higher education (finding) | Body mass index 30+ - obesity (finding) | Prediabetes (finding) | Anemia (disorder) | Has a criminal record (finding) | Full-time employment (finding) | Medication review due (situation) | Acute viral pharyngitis (disorder) | Multiple myeloma (disorder) | Awaiting transplantation of bone marrow (situation) | Unemployed (finding) | Stress (finding) | Gingivitis (disorder) | History of autologous bone marrow transplant (situation) | Acute bronchitis (disorder) | Reports of violence in the environment (finding) | Injury of neck (disorder) | Whiplash injury to neck (disorder) | Part-time employment (finding) | Not in labor force (finding) | Limited social contact (finding) | Ischemic heart disease (disorder) | Abnormal findings diagnostic imaging heart+coronary circulat (finding) | Victim of intimate partner abuse (finding),0.0,0.0,0.0,0.0,0.0,0.0,0.0,0.0,0.0,0.0,0.0,0.0,0.0,0.0,0.0,0.0,0.0,0.0,0.0,0.0,0.0,1.0,0.0,0.0,0.0,0.0,0.0,0.0,0.0,0.0,0.0,0.0,0.0,0.0,0.0,0.0,0.0,0.0,0.0,0.0,0.0,1.0,0.0,0.0,0.0,0.0,0.0,0.0,0.0,0.0,0.0,0.0,1.0,0.0,0.0,0.0,0.0,0.0,0.0,0.0,0.0,0.0,0.0,0.0,0.0,0.0,0.0,0.0,0.0,0.0,0.0,1.0,1.0,0.0,0.0,0.0,0.0,0.0,1.0,0.0,0.0,0.0,0.0,0.0,0.0,0.0,0.0,0.0,0.0,0.0,0.0,0.0,0.0,0.0,0.0,0.0,0.0,0.0,0.0,0.0,0.0,0.0,0.0,0.0,0.0,0.0,0.0,0.0,0.0,0.0,0.0,0.0,0.0,0.0,0.0,0.0,0.0,0.0,0.0,0.0,0.0,5.0,0.0,0.0,0.0,0.0,0.0,0.0,0.0,0.0,0.0,0.0,0.0,0.0,0.0,0.0,45.0,0.0,1.0,0.0,0.0,0.0,0.0,1.0,0.0,0.0,0.0,0.0,0.0,0.0,0.0,1.0,0.0,0.0,0.0,0.0,0.0,0.0,0.0,0.0,0.0,0.0,0.0,0.0,1.0,0.0,0.0,0.0,0.0,0.0,0.0,0.0
e2b7d298-e3e5-8e5a-804c-a8342fdeb164,69,F,white,nonhispanic,109027,617728.28,Risk activity involvement (finding) | Received higher education (finding) | Lack of access to transportation (finding) | Prediabetes (finding) | Anemia (disorder) | Transport problem (finding) | Seizure disorder (disorder) | History of seizure (situation) | Body mass index 30+ - obesity (finding) | Social isolation (finding) | Ischemic heart disease (disorder) | Has a criminal record (finding) | Abnormal findings diagnostic imaging heart+coronary circulat (finding) | Victim of intimate partner abuse (finding) | Full-time employment (finding) | Stress (finding) | Medication review due (situation) | Part-time employment (finding) | Limited social contact (finding) | Reports of violence in the environment (finding) | Gingivitis (disorder) | Acute bronchitis (disorder) | Acute viral pharyngitis (disorder) | Dental filling lost (finding) | Burn injury (morphologic abnormality) | Partial thickness burn (disorder) | Chronic intractable migraine without aura (disorder) | Unemployed (finding) | Unhealthy alcohol drinking behavior (finding) | Viral sinusitis (disorder),0.0,0.0,0.0,0.0,0.0,0.0,0.0,0.0,0.0,0.0,0.0,0.0,0.0,0.0,0.0,0.0,0.0,0.0,0.0,0.0,0.0,1.0,0.0,0.0,0.0,0.0,0.0,0.0,0.0,0.0,0.0,0.0,0.0,0.0,0.0,0.0,0.0,0.0,0.0,1.0,0.0,1.0,0.0,0.0,0.0,0.0,1.0,0.0,0.0,0.0,0.0,0.0,1.0,0.0,0.0,0.0,0.0,0.0,0.0,0.0,0.0,0.0,0.0,0.0,0.0,0.0,1.0,0.0,0.0,0.0,0.0,1.0,1.0,0.0,0.0,0.0,0.0,0.0,1.0,0.0,0.0,0.0,0.0,0.0,0.0,0.0,0.0,0.0,0.0,0.0,0.0,0.0,0.0,0.0,0.0,0.0,0.0,0.0,0.0,0.0,0.0,0.0,0.0,0.0,0.0,0.0,0.0,0.0,0.0,0.0,0.0,0.0,0.0,0.0,0.0,0.0,0.0,0.0,0.0,0.0,0.0,1.0,0.0,0.0,0.0,0.0,0.0,0.0,0.0,0.0,0.0,0.0,0.0,0.0,0.0,0.0,95.0,0.0,1.0,0.0,0.0,0.0,0.0,0.0,0.0,0.0,0.0,0.0,0.0,0.0,0.0,0.0,0.0,0.0,0.0,0.0,0.0,0.0,0.0,0.0,0.0,0.0,0.0,0.0,1.0,0.0,0.0,0.0,0.0,0.0,0.0,0.0
ca4f2fef-0fea-5cdb-314c-9d6689cfabb0,21,F,white,hispanic,125882,11148.62,Atopic dermatitis (disorder) | Chronic sinusitis (disorder) | Seasonal allergic rhinitis (disorder) | Medication review due (situation) | Acute viral pharyngitis (disorder) | Sprain (morphologic abnormality) | Sprain of ankle (disorder) | Gingivitis (disorder) | Acute allergic reaction (disorder) | Acute bronchitis (disorder) | Viral sinusitis (disorder) | Gingival disease (disorder) | Fracture of bone (disorder) | Closed fracture of hip (disorder) | Acute infective cystitis (disorder) | Educated to high school level (finding) | Full-time employment (finding) | Stress (finding),0.0,0.0,0.0,0.0,0.0,0.0,0.0,0.0,0.0,0.0,0.0,0.0,0.0,0.0,0.0,0.0,0.0,0.0,0.0,0.0,0.0,0.0,0.0,0.0,0.0,0.0,0.0,0.0,0.0,0.0,0.0,0.0,0.0,0.0,0.0,0.0,0.0,0.0,0.0,0.0,0.0,1.0,0.0,0.0,0.0,0.0,0.0,0.0,0.0,0.0,0.0,0.0,0.0,0.0,0.0,1.0,0.0,0.0,0.0,0.0,0.0,0.0,1.0,0.0,0.0,0.0,1.0,0.0,1.0,0.0,0.0,1.0,0.0,0.0,0.0,0.0,0.0,0.0,0.0,0.0,0.0,0.0,0.0,0.0,0.0,0.0,0.0,0.0,0.0,0.0,0.0,0.0,0.0,0.0,0.0,0.0,0.0,0.0,0.0,0.0,0.0,0.0,0.0,0.0,0.0,0.0,0.0,0.0,0.0,0.0,0.0,0.0,0.0,0.0,0.0,0.0,0.0,1.0,0.0,0.0,0.0,2.0,1.0,0.0,0.0,0.0,0.0,0.0,0.0,0.0,0.0,0.0,1.0,0.0,0.0,1.0,84.0,0.0,1.0,1.0,0.0,0.0,0.0,0.0,0.0,0.0,0.0,0.0,0.0,0.0,0.0,1.0,0.0,0.0,0.0,0.0,0.0,0.0,0.0,0.0,0.0,0.0,0.0,0.0,1.0,0.0,0.0,0.0,0.0,0.0,0.0,0.0
36a8268b-0e08-f9d6-6999-eca371aab83c,48,F,asian,nonhispanic,65255,739328.17,Adolescent idiopathic scoliosis (disorder) | Chronic sinusitis (disorder) | Received higher education (finding) | Limited social contact (finding) | Social isolation (finding) | Part-time employment (finding) | Acute infective cystitis (disorder) | Medication review due (situation) | Prediabetes (finding) | Anemia (disorder) | Victim of intimate partner abuse (finding) | Gingivitis (disorder) | Gingival disease (disorder) | Essential hypertension (disorder) | Full-time employment (finding) | Fractured dental filling (finding) | Stress (finding),0.0,0.0,0.0,0.0,0.0,1.0,0.0,0.0,0.0,0.0,0.0,0.0,0.0,0.0,0.0,0.0,0.0,0.0,0.0,0.0,0.0,0.0,0.0,0.0,0.0,0.0,0.0,0.0,0.0,0.0,0.0,0.0,0.0,0.0,0.0,0.0,0.0,0.0,0.0,0.0,0.0,0.0,0.0,0.0,0.0,0.0,0.0,0.0,0.0,0.0,0.0,0.0,0.0,0.0,0.0,0.0,0.0,0.0,0.0,7.0,0.0,0.0,0.0,0.0,0.0,0.0,0.0,0.0,0.0,0.0,0.0,0.0,0.0,0.0,0.0,0.0,0.0,0.0,0.0,0.0,0.0,0.0,0.0,0.0,0.0,0.0,0.0,0.0,0.0,0.0,0.0,0.0,0.0,0.0,0.0,0.0,0.0,1.0,0.0,0.0,0.0,0.0,0.0,0.0,2.0,0.0,0.0,0.0,0.0,0.0,0.0,0.0,1.0,0.0,0.0,0.0,0.0,0.0,0.0,0.0,0.0,3.0,1.0,0.0,0.0,0.0,0.0,0.0,0.0,1.0,0.0,0.0,0.0,0.0,0.0,1.0,23.0,0.0,0.0,1.0,0.0,0.0,0.0,0.0,0.0,0.0,0.0,0.0,0.0,0.0,1.0,1.0,0.0,0.0,0.0,0.0,0.0,0.0,0.0,0.0,0.0,0.0,0.0,0.0,1.0,0.0,0.0,0.0,0.0,0.0,0.0,0.0
7bfad7bf-fbc0-2a68-6c37-b9351c1ec651,13,F,black,nonhispanic,136314,17836.6,Medication review due (situation) | Viral sinusitis (disorder) | Primary dental caries (disorder) | Acute viral pharyngitis (disorder) | Gingivitis (disorder),0.0,0.0,0.0,0.0,0.0,0.0,0.0,0.0,0.0,0.0,0.0,0.0,0.0,0.0,0.0,0.0,0.0,0.0,0.0,0.0,0.0,0.0,0.0,0.0,0.0,0.0,0.0,0.0,0.0,0.0,0.0,0.0,0.0,0.0,0.0,0.0,0.0,0.0,0.0,0.0,0.0,0.0,0.0,0.0,0.0,0.0,0.0,0.0,0.0,0.0,0.0,0.0,0.0,0.0,0.0,0.0,0.0,0.0,0.0,0.0,0.0,0.0,0.0,0.0,0.0,0.0,0.0,0.0,0.0,0.0,0.0,0.0,0.0,0.0,0.0,0.0,0.0,0.0,0.0,0.0,0.0,0.0,0.0,0.0,0.0,0.0,0.0,0.0,0.0,0.0,0.0,0.0,0.0,0.0,0.0,0.0,0.0,0.0,0.0,0.0,0.0,0.0,0.0,0.0,0.0,0.0,0.0,0.0,0.0,0.0,0.0,0.0,0.0,0.0,0.0,0.0,0.0,0.0,0.0,0.0,0.0,3.0,0.0,0.0,0.0,0.0,0.0,0.0,0.0,0.0,0.0,0.0,0.0,0.0,0.0,0.0,53.0,0.0,0.0,0.0,0.0,0.0,0.0,0.0,0.0,0.0,0.0,0.0,0.0,0.0,0.0,0.0,0.0,0.0,0.0,0.0,0.0,0.0,0.0,0.0,0.0,0.0,0.0,0.0,1.0,0.0,0.0,0.0,0.0,0.0,0.0,0.0
d2bf16e1-62a2-a46e-284c-c923e3fa4327,8,F,white,nonhispanic,2793,1318.72,Medication review due (situation) | Injury of knee (disorder) | Injury of medial collateral ligament of knee (disorder) | Otitis media (disorder) | Viral sinusitis (disorder) | Acute bronchitis (disorder),0.0,0.0,0.0,0.0,0.0,0.0,0.0,0.0,0.0,0.0,0.0,0.0,0.0,0.0,0.0,0.0,0.0,0.0,0.0,0.0,0.0,0.0,0.0,0.0,0.0,0.0,0.0,0.0,0.0,0.0,0.0,0.0,0.0,1.0,0.0,0.0,0.0,0.0,0.0,0.0,0.0,0.0,0.0,0.0,0.0,0.0,0.0,1.0,0.0,0.0,0.0,0.0,0.0,0.0,0.0,0.0,0.0,0.0,0.0,0.0,0.0,2.0,0.0,0.0,0.0,0.0,0.0,0.0,0.0,0.0,0.0,0.0,0.0,0.0,0.0,0.0,0.0,0.0,0.0,0.0,0.0,0.0,0.0,0.0,0.0,0.0,0.0,0.0,0.0,0.0,0.0,0.0,0.0,0.0,0.0,0.0,0.0,0.0,0.0,0.0,0.0,0.0,0.0,0.0,0.0,0.0,0.0,0.0,0.0,0.0,0.0,0.0,0.0,0.0,0.0,0.0,0.0,0.0,0.0,0.0,0.0,0.0,0.0,0.0,0.0,0.0,0.0,0.0,0.0,0.0,0.0,0.0,0.0,0.0,0.0,0.0,88.0,0.0,1.0,0.0,0.0,0.0,0.0,0.0,0.0,0.0,0.0,0.0,0.0,0.0,0.0,0.0,0.0,0.0,0.0,0.0,0.0,0.0,0.0,0.0,0.0,0.0,0.0,0.0,0.0,0.0,0.0,0.0,0.0,0.0,0.0,0.0
9bd60b50-8402-5f9a-6f24-f492e8729eb5,5,F,white,nonhispanic,104525,29522.41,Medication review due (situation) | Viral sinusitis (disorder) | Otitis media (disorder) | Acute allergic reaction (disorder) | Acute bronchitis (disorder) | Perennial allergic rhinitis with seasonal variation (disorder) | Childhood asthma (disorder),0.0,0.0,0.0,0.0,0.0,0.0,0.0,0.0,0.0,0.0,0.0,0.0,0.0,0.0,0.0,0.0,0.0,0.0,0.0,0.0,0.0,0.0,0.0,0.0,0.0,0.0,0.0,0.0,0.0,0.0,0.0,0.0,1.0,1.0,0.0,0.0,0.0,0.0,0.0,0.0,0.0,3.0,0.0,0.0,0.0,0.0,0.0,1.0,8.0,0.0,0.0,0.0,0.0,0.0,0.0,0.0,0.0,0.0,0.0,0.0,0.0,3.0,0.0,0.0,0.0,0.0,0.0,0.0,1.0,8.0,0.0,0.0,0.0,0.0,0.0,0.0,0.0,0.0,0.0,0.0,0.0,0.0,0.0,0.0,0.0,0.0,0.0,0.0,0.0,0.0,0.0,0.0,1.0,0.0,0.0,0.0,0.0,0.0,0.0,0.0,0.0,0.0,0.0,0.0,0.0,0.0,0.0,0.0,0.0,0.0,0.0,0.0,0.0,0.0,0.0,0.0,0.0,1.0,0.0,0.0,0.0,0.0,0.0,0.0,0.0,0.0,0.0,0.0,0.0,0.0,0.0,0.0,0.0,0.0,0.0,0.0,61.0,0.0,1.0,0.0,0.0,0.0,0.0,0.0,0.0,1.0,0.0,0.0,0.0,0.0,0.0,0.0,0.0,0.0,0.0,0.0,0.0,0.0,0.0,0.0,0.0,0.0,0.0,0.0,0.0,0.0,0.0,0.0,0.0,0.0,0.0,0.0
5094c0f7-119a-924c-13ef-53d054461d21,29,M,white,hispanic,5354,9393.35,Perennial allergic rhinitis (disorder) | Adolescent idiopathic scoliosis (disorder) | Chronic pain (finding) | Chronic low back pain (finding) | Medication review due (situation) | Educated to high school level (finding) | Full-time employment (finding) | Social isolation (finding) | Viral sinusitis (disorder) | Suspected disease caused by Severe acute respiratory coronavirus 2 (situation) | Cough (finding) | Fever (finding) | Disease caused by severe acute respiratory syndrome coronavirus 2 (disorder) | Stress (finding),0.0,0.0,0.0,0.0,0.0,0.0,0.0,0.0,0.0,0.0,0.0,0.0,0.0,0.0,0.0,0.0,0.0,0.0,0.0,0.0,0.0,0.0,0.0,0.0,0.0,0.0,0.0,0.0,0.0,0.0,0.0,0.0,0.0,0.0,0.0,0.0,0.0,0.0,0.0,0.0,0.0,0.0,0.0,0.0,0.0,0.0,0.0,0.0,0.0,0.0,0.0,0.0,0.0,0.0,0.0,1.0,0.0,0.0,0.0,0.0,0.0,0.0,0.0,0.0,0.0,0.0,0.0,0.0,1.0,0.0,0.0,0.0,0.0,0.0,0.0,0.0,0.0,0.0,0.0,0.0,0.0,0.0,0.0,0.0,0.0,0.0,0.0,0.0,0.0,0.0,0.0,0.0,0.0,0.0,0.0,0.0,0.0,0.0,0.0,0.0,0.0,0.0,0.0,0.0,0.0,0.0,0.0,0.0,0.0,0.0,0.0,0.0,0.0,0.0,0.0,0.0,0.0,0.0,0.0,0.0,0.0,1.0,0.0,0.0,0.0,0.0,0.0,0.0,0.0,0.0,0.0,0.0,0.0,0.0,0.0,0.0,33.0,0.0,0.0,0.0,0.0,0.0,0.0,0.0,0.0,0.0,0.0,0.0,0.0,0.0,0.0,0.0,0.0,0.0,0.0,0.0,0.0,0.0,0.0,0.0,0.0,0.0,0.0,0.0,1.0,0.0,0.0,0.0,0.0,0.0,0.0,0.0
514ad0de-384b-577c-4de4-78cb2d156391,54,F,white,nonhispanic,35328,803162.28,Educated to high school level (finding) | Body mass index 30+ - obesity (finding) | Chronic pain (finding) | Transformed migraine (disorder) | Past pregnancy history of miscarriage (situation) | Full-time employment (finding) | Stress (finding) | Viral sinusitis (disorder) | Medication review due (situation) | Reports of violence in the environment (finding) | Part-time employment (finding) | Unemployed (finding) | Infection of tooth (disorder) | Gingivitis (disorder) | Limited social contact (finding) | Not in labor force (finding),0.0,0.0,0.0,0.0,0.0,0.0,0.0,0.0,0.0,0.0,0.0,0.0,0.0,0.0,0.0,0.0,0.0,0.0,0.0,0.0,0.0,0.0,0.0,0.0,0.0,0.0,0.0,0.0,0.0,0.0,0.0,0.0,0.0,0.0,0.0,0.0,11.0,0.0,0.0,0.0,0.0,0.0,0.0,0.0,0.0,0.0,0.0,0.0,0.0,0.0,0.0,0.0,0.0,0.0,0.0,0.0,0.0,0.0,0.0,0.0,0.0,0.0,0.0,0.0,0.0,0.0,0.0,0.0,0.0,0.0,0.0,0.0,0.0,0.0,0.0,0.0,0.0,0.0,0.0,0.0,0.0,0.0,0.0,0.0,0.0,0.0,0.0,0.0,0.0,0.0,0.0,0.0,0.0,0.0,0.0,0.0,0.0,0.0,0.0,0.0,0.0,0.0,0.0,0.0,0.0,0.0,0.0,0.0,0.0,0.0,0.0,0.0,0.0,0.0,0.0,0.0,0.0,0.0,0.0,0.0,0.0,2.0,0.0,0.0,0.0,0.0,0.0,1.0,1.0,0.0,0.0,1.0,1.0,0.0,0.0,0.0,34.0,0.0,0.0,0.0,0.0,0.0,0.0,0.0,0.0,0.0,0.0,0.0,0.0,0.0,0.0,1.0,0.0,0.0,0.0,0.0,0.0,0.0,0.0,0.0,0.0,0.0,0.0,0.0,1.0,0.0,0.0,0.0,0.0,0.0,0.0,0.0
e39fa777-dc9e-e86a-4137-01b23ae746a5,50,F,white,nonhispanic,97594,568961.85,Educated to high school level (finding) | Past pregnancy history of miscarriage (situation) | Medication review due (situation) | Part-time employment (finding) | Stress (finding) | Victim of intimate partner abuse (finding) | Body mass index 30+ - obesity (finding) | Full-time employment (finding) | Acute viral pharyngitis (disorder) | Laceration - injury (disorder) | Laceration of forearm (disorder) | Not in labor force (finding) | Viral sinusitis (disorder) | Acute bacterial sinusitis (disorder) | Burn injury (morphologic abnormality) | Partial thickness burn (disorder) | Traumatic injury of spinal cord and/or vertebral column (disorder) | Fracture of vertebral column with spinal cord injury (disorder) | Chronic paralysis due to lesion of spinal cord (disorder),0.0,0.0,0.0,0.0,0.0,0.0,0.0,0.0,0.0,0.0,0.0,0.0,0.0,0.0,0.0,1.0,0.0,0.0,0.0,0.0,0.0,0.0,0.0,0.0,0.0,0.0,0.0,0.0,0.0,0.0,0.0,0.0,0.0,0.0,0.0,0.0,0.0,0.0,0.0,0.0,2.0,2.0,0.0,0.0,0.0,1.0,1.0,0.0,0.0,0.0,0.0,0.0,0.0,0.0,0.0,0.0,0.0,0.0,0.0,0.0,0.0,0.0,0.0,0.0,0.0,0.0,0.0,0.0,0.0,0.0,0.0,0.0,0.0,0.0,0.0,0.0,0.0,0.0,0.0,0.0,0.0,0.0,0.0,0.0,0.0,0.0,0.0,0.0,0.0,0.0,0.0,0.0,0.0,0.0,0.0,0.0,0.0,0.0,0.0,0.0,0.0,0.0,0.0,1.0,1.0,0.0,0.0,0.0,0.0,0.0,0.0,0.0,0.0,0.0,0.0,0.0,0.0,0.0,0.0,0.0,0.0,0.0,0.0,0.0,0.0,0.0,0.0,4.0,1.0,0.0,0.0,0.0,0.0,0.0,0.0,0.0,96.0,1.0,0.0,0.0,0.0,0.0,0.0,0.0,0.0,0.0,0.0,0.0,0.0,0.0,0.0,0.0,0.0,0.0,0.0,0.0,0.0,0.0,0.0,0.0,0.0,0.0,0.0,0.0,0.0,0.0,0.0,0.0,0.0,0.0,0.0,0.0
01ba763c-ce8b-7610-7ff0-c5ed527ec673,29,M,white,nonhispanic,190561,113705.38,Medication review due (situation) | Acute viral pharyngitis (disorder) | Chronic pain (finding) | Chronic low back pain (finding) | Chronic neck pain (finding) | Received higher education (finding) | Part-time employment (finding) | Stress (finding) | Reports of violence in the environment (finding) | Gingivitis (disorder) | Full-time employment (finding) | Unhealthy alcohol drinking behavior (finding) | Sepsis (disorder) | Acute respiratory distress syndrome (disorder),0.0,0.0,0.0,0.0,0.0,0.0,0.0,0.0,0.0,0.0,0.0,0.0,0.0,0.0,1.0,0.0,0.0,0.0,0.0,0.0,0.0,0.0,0.0,0.0,0.0,0.0,1.0,0.0,0.0,0.0,0.0,0.0,0.0,0.0,9.0,0.0,1.0,0.0,0.0,0.0,0.0,0.0,0.0,0.0,0.0,0.0,0.0,0.0,0.0,0.0,0.0,0.0,0.0,0.0,0.0,0.0,0.0,0.0,0.0,0.0,0.0,0.0,0.0,0.0,0.0,0.0,0.0,0.0,0.0,0.0,0.0,0.0,0.0,0.0,0.0,0.0,0.0,0.0,0.0,0.0,0.0,0.0,0.0,0.0,0.0,0.0,0.0,0.0,0.0,0.0,0.0,0.0,0.0,0.0,0.0,0.0,0.0,0.0,0.0,0.0,0.0,0.0,0.0,0.0,0.0,0.0,0.0,0.0,0.0,0.0,0.0,0.0,0.0,0.0,1.0,0.0,0.0,0.0,0.0,0.0,0.0,2.0,0.0,0.0,0.0,0.0,0.0,0.0,0.0,0.0,0.0,0.0,0.0,0.0,0.0,0.0,0.0,0.0,0.0,0.0,0.0,0.0,0.0,0.0,0.0,0.0,0.0,0.0,0.0,0.0,0.0,1.0,0.0,0.0,0.0,0.0,0.0,0.0,0.0,0.0,0.0,0.0,0.0,0.0,1.0,0.0,0.0,1.0,1.0,0.0,0.0,0.0
e7e5161c-9176-dca9-3b7b-657aba5cd107,47,F,white,hispanic,44757,524532.4,Educated to high school level (finding) | Victim of intimate partner abuse (finding) | Refugee (person) | Medication review due (situation) | Chronic sinusitis (disorder) | Full-time employment (finding) | Part-time employment (finding) | Limited social contact (finding) | Severe anxiety (panic) (finding) | Normal pregnancy (finding) | Social isolation (finding) | Stress (finding) | Essential hypertension (disorder) | Body mass index 30+ - obesity (finding) | Sprain (morphologic abnormality) | Sprain of wrist (disorder) | Metabolic syndrome X (disorder) | Prediabetes (finding) | Reports of violence in the environment (finding) | Acute viral pharyngitis (disorder) | Gingivitis (disorder) | Unemployed (finding) | Unhealthy alcohol drinking behavior (finding) | Acute bronchitis (disorder),0.0,0.0,0.0,0.0,0.0,2.0,0.0,0.0,0.0,0.0,0.0,0.0,0.0,0.0,0.0,0.0,0.0,0.0,0.0,0.0,0.0,0.0,0.0,0.0,0.0,0.0,0.0,0.0,0.0,0.0,0.0,0.0,0.0,1.0,0.0,0.0,0.0,0.0,0.0,0.0,0.0,1.0,0.0,0.0,0.0,0.0,0.0,0.0,0.0,0.0,0.0,0.0,0.0,0.0,0.0,0.0,0.0,0.0,0.0,6.0,0.0,0.0,0.0,0.0,0.0,0.0,0.0,0.0,0.0,0.0,0.0,0.0,0.0,0.0,0.0,0.0,0.0,0.0,0.0,0.0,1.0,0.0,0.0,6.0,0.0,0.0,0.0,0.0,0.0,0.0,0.0,0.0,0.0,0.0,0.0,0.0,0.0,0.0,0.0,0.0,0.0,0.0,0.0,1.0,0.0,0.0,7.0,0.0,0.0,0.0,0.0,0.0,0.0,0.0,0.0,0.0,0.0,0.0,0.0,0.0,0.0,2.0,0.0,0.0,0.0,0.0,0.0,0.0,0.0,0.0,1.0,0.0,0.0,0.0,0.0,0.0,99.0,0.0,1.0,0.0,0.0,0.0,0.0,0.0,0.0,0.0,0.0,0.0,0.0,0.0,1.0,1.0,0.0,0.0,0.0,0.0,0.0,0.0,0.0,0.0,0.0,0.0,0.0,0.0,1.0,0.0,0.0,0.0,0.0,0.0,0.0,0.0
d1e805d9-a501-36ca-bf99-5350af22a877,29,M,white,nonhispanic,190561,49321.41,Medication review due (situation) | Received higher education (finding) | Full-time employment (finding) | Social isolation (finding) | Streptococcal sore throat (disorder) | Stress (finding) | Part-time employment (finding) | Victim of intimate partner abuse (finding) | Gingivitis (disorder) | Primary dental caries (disorder) | Acute bronchitis (disorder) | Not in labor force (finding),0.0,0.0,0.0,0.0,0.0,0.0,0.0,0.0,0.0,0.0,0.0,0.0,0.0,0.0,0.0,0.0,0.0,0.0,0.0,0.0,0.0,0.0,0.0,0.0,0.0,0.0,0.0,0.0,0.0,0.0,0.0,0.0,0.0,0.0,0.0,0.0,0.0,0.0,0.0,0.0,0.0,1.0,0.0,0.0,0.0,0.0,0.0,0.0,0.0,0.0,0.0,0.0,0.0,0.0,0.0,0.0,0.0,0.0,0.0,0.0,0.0,0.0,0.0,0.0,0.0,0.0,0.0,0.0,0.0,0.0,0.0,0.0,0.0,0.0,0.0,1.0,0.0,0.0,0.0,0.0,0.0,0.0,0.0,0.0,0.0,0.0,0.0,0.0,0.0,0.0,0.0,0.0,0.0,0.0,0.0,0.0,0.0,0.0,0.0,0.0,0.0,0.0,0.0,0.0,0.0,0.0,0.0,0.0,0.0,0.0,0.0,0.0,0.0,0.0,0.0,0.0,0.0,0.0,0.0,0.0,0.0,1.0,0.0,0.0,0.0,0.0,0.0,0.0,0.0,0.0,0.0,0.0,0.0,0.0,0.0,0.0,87.0,0.0,1.0,0.0,0.0,0.0,0.0,0.0,0.0,0.0,0.0,0.0,0.0,0.0,0.0,0.0,0.0,0.0,0.0,0.0,0.0,0.0,0.0,0.0,0.0,0.0,0.0,0.0,1.0,0.0,0.0,0.0,0.0,0.0,1.0,0.0
